13:43:17.722225 IP 172.17.0.159.54915 > 172.17.3.255.54915: UDP, length 263
13:43:18.028826 IP 172.17.0.144.5353 > 224.0.0.251.5353: UDP, length 40
13:43:18.336233 IP 172.17.0.144.61966 > 255.255.255.255.7533: UDP, length 34
13:43:18.746071 IP 172.17.0.159.54915 > 172.17.3.255.54915: UDP, length 263
13:43:18.746990 IP 172.17.0.130.5353 > 224.0.0.251.5353: UDP, length 61
13:43:18.848091 IP 172.17.0.142.68 > 255.255.255.255.67: UDP, length 300
13:43:19.257534 IP 172.17.0.144.27005 > 255.255.255.255.27015: UDP, length 33
13:43:19.258073 IP 172.17.0.144.61966 > 255.255.255.255.7533: UDP, length 34
13:43:19.258079 IP 172.17.0.122.5353 > 224.0.0.251.5353: UDP, length 40
13:43:19.462249 IP 172.17.0.144.27005 > 255.255.255.255.27015: UDP, length 33
13:43:19.565377 IP 172.17.0.144.27005 > 255.255.255.255.27015: UDP, length 33
13:43:19.669844 IP 172.17.0.130.5353 > 224.0.0.251.5353: UDP, length 61
13:43:19.770242 IP 172.17.0.159.54915 > 172.17.3.255.54915: UDP, length 263
13:43:20.281616 IP 172.17.0.144.61966 > 255.255.255.255.7533: UDP, length 34
13:43:20.793672 IP 172.17.0.159.54915 > 172.17.3.255.54915: UDP, length 263
13:43:21.305353 IP 172.17.0.144.61966 > 255.255.255.255.7533: UDP, length 34
13:43:21.817783 IP 172.17.0.159.54915 > 172.17.3.255.54915: UDP, length 263
13:43:21.818161 IP 172.17.0.107.5353 > 224.0.0.251.5353: UDP, length 156
13:43:21.818570 IP 172.17.0.107.5353 > 224.0.0.251.5353: UDP, length 216
13:43:22.227055 IP 172.17.0.116.17500 > 255.255.255.255.17500: UDP, length 157
13:43:22.227661 IP 172.17.0.116.17500 > 172.17.3.255.17500: UDP, length 157
13:43:22.228677 IP 172.17.0.107.5353 > 224.0.0.251.5353: UDP, length 186
13:43:22.329450 IP 172.17.0.144.61966 > 255.255.255.255.7533: UDP, length 34
13:43:22.432867 IP 172.17.0.107.5353 > 224.0.0.251.5353: UDP, length 186
13:43:22.637642 IP 172.17.0.107.5353 > 224.0.0.251.5353: UDP, length 186
13:43:22.743352 IP 172.17.0.130.5353 > 224.0.0.251.5353: UDP, length 61
13:43:22.743355 IP 209.85.234.189.443 > 172.17.0.115.49343: UDP, length 214
13:43:22.743356 IP 209.85.234.189.443 > 172.17.0.115.49343: UDP, length 18
13:43:22.743517 IP 172.17.0.115.49343 > 209.85.234.189.443: UDP, length 38
13:43:22.752099 IP 172.17.0.115.49343 > 209.85.234.189.443: UDP, length 321
13:43:22.752407 IP 209.85.234.189.443 > 172.17.0.115.49343: UDP, length 198
13:43:22.778385 IP 172.17.0.115.49343 > 209.85.234.189.443: UDP, length 35
13:43:22.795628 IP 209.85.234.189.443 > 172.17.0.115.49343: UDP, length 30
13:43:22.816246 IP 209.85.234.189.443 > 172.17.0.115.49343: UDP, length 61
13:43:22.816249 IP 209.85.234.189.443 > 172.17.0.115.49343: UDP, length 37
13:43:22.816508 IP 172.17.0.115.49343 > 209.85.234.189.443: UDP, length 41
13:43:22.841709 IP 172.17.0.159.54915 > 172.17.3.255.54915: UDP, length 263
13:43:22.842892 IP 172.17.0.107.5353 > 224.0.0.251.5353: UDP, length 156
13:43:22.843195 IP 172.17.0.107.5353 > 224.0.0.251.5353: UDP, length 267
13:43:22.935820 IP 172.17.0.115.57187 > 52.84.67.50.443: tcp 0
13:43:22.945018 IP 172.17.0.107.5353 > 224.0.0.251.5353: UDP, length 242
13:43:22.945023 IP 52.84.67.50.443 > 172.17.0.115.57187: tcp 0
13:43:23.251074 IP 172.17.0.144.61966 > 255.255.255.255.7533: UDP, length 34
13:43:23.559303 IP 172.17.0.107.5353 > 224.0.0.251.5353: UDP, length 279
13:43:23.865409 IP 172.17.0.159.54915 > 172.17.3.255.54915: UDP, length 263
13:43:23.968221 ARP, Request who-has 172.17.0.112 tell 10.128.128.128, length 46
13:43:23.968225 ARP, Request who-has 172.17.0.120 tell 10.128.128.128, length 46
13:43:23.968292 ARP, Request who-has 172.17.0.122 tell 10.128.128.128, length 46
13:43:23.968506 ARP, Request who-has 172.17.0.149 tell 10.128.128.128, length 46
13:43:23.968620 ARP, Request who-has 172.17.0.158 tell 10.128.128.128, length 46
13:43:23.981149 ARP, Request who-has 172.17.0.115 tell 10.128.128.128, length 46
13:43:23.981164 ARP, Reply 172.17.0.115 is-at 48:d7:05:cd:1c:53, length 28
13:43:24.275209 IP 172.17.0.144.61966 > 255.255.255.255.7533: UDP, length 34
13:43:24.383021 IP 172.17.0.115.57154 > 52.84.1.51.443: tcp 0
13:43:24.392663 IP 52.84.1.51.443 > 172.17.0.115.57154: tcp 0
13:43:24.564469 IP 172.17.0.115.57141 > 54.197.21.112.443: tcp 62
13:43:24.596178 IP 54.197.21.112.443 > 172.17.0.115.57141: tcp 62
13:43:24.596230 IP 172.17.0.115.57141 > 54.197.21.112.443: tcp 0
13:43:24.787339 IP 172.17.0.159.54915 > 172.17.3.255.54915: UDP, length 263
13:43:24.890044 IP 172.17.0.107.5353 > 224.0.0.251.5353: UDP, length 436
13:43:25.298754 IP 172.17.0.144.61966 > 255.255.255.255.7533: UDP, length 34
13:43:25.345746 IP 172.17.0.115.50149 > 172.17.0.1.53: UDP, length 33
13:43:25.347686 IP 172.17.0.1.53 > 172.17.0.115.50149: UDP, length 49
13:43:25.348088 IP 172.17.0.115.56699 > 172.217.1.46.443: UDP, length 1350
13:43:25.357922 IP 172.217.1.46.443 > 172.17.0.115.56699: UDP, length 1350
13:43:25.358414 IP 172.217.1.46.443 > 172.17.0.115.56699: UDP, length 1350
13:43:25.362893 IP 172.17.0.115.56699 > 172.217.1.46.443: UDP, length 38
13:43:25.363139 IP 172.17.0.115.57184 > 64.233.191.189.443: tcp 0
13:43:25.363613 IP 172.17.0.115.57195 > 172.217.1.46.443: tcp 0
13:43:25.371730 IP 172.17.0.115.56699 > 172.217.1.46.443: UDP, length 1350
13:43:25.372258 IP 172.217.1.46.443 > 172.17.0.115.57195: tcp 0
13:43:25.372297 IP 172.17.0.115.57195 > 172.217.1.46.443: tcp 0
13:43:25.373040 IP 172.17.0.115.57195 > 172.217.1.46.443: tcp 517
13:43:25.381391 IP 64.233.191.189.443 > 172.17.0.115.57184: tcp 0
13:43:25.381478 IP 172.17.0.115.57184 > 64.233.191.189.443: tcp 0
13:43:25.384871 IP 172.217.1.46.443 > 172.17.0.115.57195: tcp 0
13:43:25.385500 IP 172.217.1.46.443 > 172.17.0.115.56699: UDP, length 1350
13:43:25.385505 IP 172.217.1.46.443 > 172.17.0.115.57195: tcp 160
13:43:25.385560 IP 172.17.0.115.57195 > 172.217.1.46.443: tcp 0
13:43:25.386267 IP 172.17.0.115.56699 > 172.217.1.46.443: UDP, length 1160
13:43:25.386318 IP 172.17.0.115.56699 > 172.217.1.46.443: UDP, length 1350
13:43:25.386340 IP 172.17.0.115.56699 > 172.217.1.46.443: UDP, length 1350
13:43:25.386358 IP 172.17.0.115.56699 > 172.217.1.46.443: UDP, length 595
13:43:25.386861 IP 172.17.0.115.57195 > 172.217.1.46.443: tcp 216
13:43:25.388557 IP 172.17.0.115.57195 > 172.217.1.46.443: tcp 53
13:43:25.388586 IP 172.17.0.115.57195 > 172.217.1.46.443: tcp 56
13:43:25.388601 IP 172.17.0.115.57195 > 172.217.1.46.443: tcp 42
13:43:25.396546 IP 172.217.1.46.443 > 172.17.0.115.57195: tcp 56
13:43:25.396549 IP 172.217.1.46.443 > 172.17.0.115.57195: tcp 42
13:43:25.396551 IP 172.217.1.46.443 > 172.17.0.115.56699: UDP, length 33
13:43:25.396591 IP 172.17.0.115.57195 > 172.217.1.46.443: tcp 0
13:43:25.396604 IP 172.17.0.115.57195 > 172.217.1.46.443: tcp 0
13:43:25.396704 IP 172.17.0.115.57195 > 172.217.1.46.443: tcp 38
13:43:25.396868 IP 172.217.1.46.443 > 172.17.0.115.56699: UDP, length 1350
13:43:25.396978 IP 172.17.0.115.56699 > 172.217.1.46.443: UDP, length 41
13:43:25.397368 IP 172.217.1.46.443 > 172.17.0.115.57195: tcp 0
13:43:25.397370 IP 172.217.1.46.443 > 172.17.0.115.57195: tcp 38
13:43:25.397394 IP 172.17.0.115.57195 > 172.217.1.46.443: tcp 0
13:43:25.422655 IP 172.217.1.46.443 > 172.17.0.115.56699: UDP, length 30
13:43:25.431732 IP 172.217.1.46.443 > 172.17.0.115.56699: UDP, length 168
13:43:25.443584 IP 172.17.0.115.57195 > 172.217.1.46.443: tcp 38
13:43:25.445856 IP 172.217.1.46.443 > 172.17.0.115.57195: tcp 0
13:43:25.452254 IP 172.217.1.46.443 > 172.17.0.115.57195: tcp 0
13:43:25.457309 IP 172.17.0.115.56699 > 172.217.1.46.443: UDP, length 38
13:43:25.655111 IP 172.17.0.115.57143 > 52.87.242.163.443: tcp 62
13:43:25.684121 IP 52.87.242.163.443 > 172.17.0.115.57143: tcp 62
13:43:25.684180 IP 172.17.0.115.57143 > 52.87.242.163.443: tcp 0
13:43:25.749667 IP 172.17.0.115.50294 > 64.233.191.189.443: UDP, length 23
13:43:25.794269 IP 64.233.191.189.443 > 172.17.0.115.50294: UDP, length 33
13:43:25.811253 IP 172.17.0.159.54915 > 172.17.3.255.54915: UDP, length 263
13:43:25.915864 IP 172.17.0.107.5353 > 224.0.0.251.5353: UDP, length 207
13:43:26.323343 IP 172.17.0.144.61966 > 255.255.255.255.7533: UDP, length 34
13:43:26.838028 IP 172.17.0.159.54915 > 172.17.3.255.54915: UDP, length 263
13:43:27.244566 IP 172.17.0.144.61966 > 255.255.255.255.7533: UDP, length 34
13:43:27.500486 IP 172.17.0.115.49306 > 64.233.181.189.443: UDP, length 23
13:43:27.544955 IP 64.233.181.189.443 > 172.17.0.115.49306: UDP, length 33
13:43:27.859333 IP 172.17.0.159.54915 > 172.17.3.255.54915: UDP, length 263
13:43:28.268593 IP 172.17.0.144.61966 > 255.255.255.255.7533: UDP, length 34
13:43:28.883552 IP 172.17.0.159.54915 > 172.17.3.255.54915: UDP, length 263
13:43:28.884466 IP 172.17.0.107.5353 > 224.0.0.251.5353: UDP, length 436
13:43:29.190033 ARP, Request who-has 172.17.0.1 tell 172.17.0.145, length 46
13:43:29.292901 IP 172.17.0.144.61966 > 255.255.255.255.7533: UDP, length 34
13:43:29.293489 IP 172.17.0.113.5353 > 224.0.0.251.5353: UDP, length 77
13:43:29.395517 IP 172.17.0.113.5353 > 224.0.0.251.5353: UDP, length 56
13:43:29.395521 IP 172.17.0.107.5353 > 224.0.0.251.5353: UDP, length 111
13:43:29.703340 IP 172.17.0.112.17500 > 255.255.255.255.17500: UDP, length 133
13:43:29.804628 IP 172.17.0.112.17500 > 172.17.3.255.17500: UDP, length 133
13:43:29.907201 IP 172.17.0.144.27005 > 255.255.255.255.27015: UDP, length 33
13:43:29.907638 IP 172.17.0.159.54915 > 172.17.3.255.54915: UDP, length 263
13:43:30.111709 IP 172.17.0.144.27005 > 255.255.255.255.27015: UDP, length 33
13:43:30.316691 IP 172.17.0.144.27005 > 255.255.255.255.27015: UDP, length 33
13:43:30.316695 IP 172.17.0.144.61966 > 255.255.255.255.7533: UDP, length 34
13:43:30.316749 IP 172.17.0.113.5353 > 224.0.0.251.5353: UDP, length 111
13:43:30.350854 IP 172.17.0.115.57177 > 172.217.1.35.443: tcp 0
13:43:30.360206 IP 172.217.1.35.443 > 172.17.0.115.57177: tcp 0
13:43:30.830740 IP 209.85.234.189.443 > 172.17.0.115.49343: UDP, length 214
13:43:30.857126 IP 172.17.0.115.49343 > 209.85.234.189.443: UDP, length 35
13:43:30.931282 IP 172.17.0.159.54915 > 172.17.3.255.54915: UDP, length 263
13:43:31.341183 IP 172.17.0.144.61966 > 255.255.255.255.7533: UDP, length 34
13:43:31.549266 IP 64.233.181.189.443 > 172.17.0.115.49306: UDP, length 39
13:43:31.575624 IP 172.17.0.115.49306 > 64.233.181.189.443: UDP, length 38
13:43:31.752163 IP 172.17.0.157.5353 > 224.0.0.251.5353: UDP, length 40
13:43:31.752166 IP 172.17.0.157.5353 > 224.0.0.251.5353: UDP, length 40
13:43:31.752417 IP 172.17.0.130.5353 > 224.0.0.251.5353: UDP, length 61
13:43:31.957046 IP 172.17.0.159.54915 > 172.17.3.255.54915: UDP, length 263
13:43:31.957049 ARP, Request who-has 172.17.0.136 tell 10.128.128.128, length 46
13:43:31.957050 ARP, Request who-has 172.17.0.153 tell 10.128.128.128, length 46
13:43:31.957104 ARP, Request who-has 172.17.0.148 tell 10.128.128.128, length 46
13:43:31.957306 ARP, Request who-has 172.17.0.134 tell 10.128.128.128, length 46
13:43:31.957539 ARP, Request who-has 172.17.0.115 tell 10.128.128.128, length 46
13:43:31.957550 ARP, Reply 172.17.0.115 is-at 48:d7:05:cd:1c:53, length 28
13:43:31.958338 ARP, Request who-has 172.17.0.114 tell 10.128.128.128, length 46
13:43:32.262203 IP 172.17.0.144.61966 > 255.255.255.255.7533: UDP, length 34
13:43:32.364362 ARP, Request who-has 172.17.0.156 tell 172.17.0.1, length 46
13:43:32.468309 IP 172.17.0.144.5353 > 224.0.0.251.5353: UDP, length 40
13:43:32.468313 IP 172.17.0.144.5353 > 224.0.0.251.5353: UDP, length 40
13:43:32.775033 IP 172.17.0.157.5353 > 224.0.0.251.5353: UDP, length 40
13:43:32.980817 IP 172.17.0.159.54915 > 172.17.3.255.54915: UDP, length 263
13:43:33.081510 IP 172.17.0.112.5353 > 224.0.0.251.5353: UDP, length 40
13:43:33.287190 IP 172.17.0.144.61966 > 255.255.255.255.7533: UDP, length 34
13:43:33.287196 IP 172.17.0.113.5353 > 224.0.0.251.5353: UDP, length 111
13:43:33.388965 ARP, Request who-has 172.17.0.156 tell 172.17.0.1, length 46
13:43:33.491717 IP 172.17.0.144.5353 > 224.0.0.251.5353: UDP, length 40
13:43:33.595718 IP 54.197.21.112.443 > 172.17.0.115.57141: tcp 712
13:43:33.595772 IP 172.17.0.115.57141 > 54.197.21.112.443: tcp 0
13:43:33.696019 IP 172.17.0.112.5353 > 224.0.0.251.5353: UDP, length 40
13:43:34.003403 IP 172.17.0.159.54915 > 172.17.3.255.54915: UDP, length 263
13:43:34.310134 IP 172.17.0.144.61966 > 255.255.255.255.7533: UDP, length 34
13:43:34.548960 IP 172.17.0.115.57152 > 52.84.67.136.443: tcp 0
13:43:34.558200 IP 52.84.67.136.443 > 172.17.0.115.57152: tcp 0
13:43:34.566817 IP 172.17.0.115.57141 > 54.197.21.112.443: tcp 62
13:43:34.595359 IP 54.197.21.112.443 > 172.17.0.115.57141: tcp 62
13:43:34.595405 IP 172.17.0.115.57141 > 54.197.21.112.443: tcp 0
13:43:34.719819 IP 172.17.0.157.5353 > 224.0.0.251.5353: UDP, length 40
13:43:34.719823 IP 172.17.0.112.5353 > 224.0.0.251.5353: UDP, length 40
13:43:34.822018 IP 172.17.0.159.137 > 172.17.3.255.137: UDP, length 50
13:43:34.925386 IP 172.17.0.159.54915 > 172.17.3.255.54915: UDP, length 263
13:43:34.926038 IP 64.233.191.189.443 > 172.17.0.115.50294: UDP, length 40
13:43:34.952398 IP 172.17.0.115.50294 > 64.233.191.189.443: UDP, length 39
13:43:35.335067 IP 172.17.0.144.61966 > 255.255.255.255.7533: UDP, length 34
13:43:35.436613 IP 172.17.0.144.5353 > 224.0.0.251.5353: UDP, length 40
13:43:35.538875 IP 172.17.0.159.137 > 172.17.3.255.137: UDP, length 50
13:43:35.654603 IP 172.17.0.115.57143 > 52.87.242.163.443: tcp 62
13:43:35.683919 IP 52.87.242.163.443 > 172.17.0.115.57143: tcp 62
13:43:35.683977 IP 172.17.0.115.57143 > 52.87.242.163.443: tcp 0
13:43:35.949032 IP 172.17.0.159.54915 > 172.17.3.255.54915: UDP, length 263
13:43:36.255547 IP 172.17.0.144.61966 > 255.255.255.255.7533: UDP, length 34
13:43:36.358215 IP 172.17.0.159.137 > 172.17.3.255.137: UDP, length 50
13:43:36.972502 IP 172.17.0.159.54915 > 172.17.3.255.54915: UDP, length 263
13:43:37.280203 IP 172.17.0.144.61966 > 255.255.255.255.7533: UDP, length 34
13:43:37.485919 IP 64.233.181.189.443 > 172.17.0.115.49306: UDP, length 39
13:43:37.511149 IP 172.17.0.115.49306 > 64.233.181.189.443: UDP, length 35
13:43:37.689330 IP 172.17.0.112.5353 > 224.0.0.251.5353: UDP, length 40
13:43:37.996977 IP 172.17.0.159.54915 > 172.17.3.255.54915: UDP, length 263
13:43:38.303767 IP 172.17.0.144.61966 > 255.255.255.255.7533: UDP, length 34
13:43:38.612146 ARP, Request who-has 172.17.0.115 tell 172.17.0.1, length 46
13:43:38.612161 ARP, Reply 172.17.0.115 is-at 48:d7:05:cd:1c:53, length 28
13:43:39.022395 IP 172.17.0.159.54915 > 172.17.3.255.54915: UDP, length 263
13:43:39.327830 IP 172.17.0.144.61966 > 255.255.255.255.7533: UDP, length 34
13:43:39.590965 IP 172.17.0.115.57183 > 64.233.191.189.443: tcp 0
13:43:39.610028 IP 64.233.191.189.443 > 172.17.0.115.57183: tcp 0
13:43:39.945486 ARP, Request who-has 172.17.0.128 tell 10.128.128.128, length 46
13:43:39.945488 ARP, Request who-has 172.17.0.123 tell 10.128.128.128, length 46
13:43:39.945490 ARP, Request who-has 172.17.0.159 tell 10.128.128.128, length 46
13:43:39.945513 ARP, Request who-has 172.17.0.126 tell 10.128.128.128, length 46
13:43:39.945804 ARP, Request who-has 172.17.0.135 tell 10.128.128.128, length 46
13:43:39.948066 ARP, Request who-has 172.17.0.117 tell 10.128.128.128, length 46
13:43:39.948068 ARP, Request who-has 172.17.0.129 tell 10.128.128.128, length 46
13:43:39.952226 ARP, Request who-has 172.17.0.115 tell 10.128.128.128, length 46
13:43:39.952246 ARP, Reply 172.17.0.115 is-at 48:d7:05:cd:1c:53, length 28
13:43:40.045486 IP 172.17.0.159.54915 > 172.17.3.255.54915: UDP, length 263
13:43:40.352325 IP 172.17.0.144.61966 > 255.255.255.255.7533: UDP, length 34
13:43:40.556444 IP 172.17.0.144.27005 > 255.255.255.255.27015: UDP, length 33
13:43:40.761332 IP 172.17.0.144.27005 > 255.255.255.255.27015: UDP, length 33
13:43:40.967040 IP 172.17.0.144.27005 > 255.255.255.255.27015: UDP, length 33
13:43:41.069188 IP 172.17.0.159.54915 > 172.17.3.255.54915: UDP, length 263
13:43:41.273853 IP 172.17.0.144.61966 > 255.255.255.255.7533: UDP, length 34
13:43:42.093178 IP 172.17.0.159.54915 > 172.17.3.255.54915: UDP, length 263
13:43:42.298653 IP 172.17.0.144.61966 > 255.255.255.255.7533: UDP, length 34
13:43:42.605625 IP 209.85.234.189.443 > 172.17.0.115.49343: UDP, length 198
13:43:42.631509 IP 172.17.0.115.49343 > 209.85.234.189.443: UDP, length 35
13:43:43.117283 IP 172.17.0.159.54915 > 172.17.3.255.54915: UDP, length 263
13:43:43.321377 IP 172.17.0.144.61966 > 255.255.255.255.7533: UDP, length 34
13:43:43.833589 IP 172.17.0.145.5353 > 224.0.0.251.5353: UDP, length 40
13:43:43.833592 IP 172.17.0.145.5353 > 224.0.0.251.5353: UDP, length 40
13:43:44.140513 IP 172.17.0.159.54915 > 172.17.3.255.54915: UDP, length 263
13:43:44.345190 IP 172.17.0.144.61966 > 255.255.255.255.7533: UDP, length 34
13:43:44.564495 IP 172.17.0.115.57141 > 54.197.21.112.443: tcp 62
13:43:44.594072 IP 54.197.21.112.443 > 172.17.0.115.57141: tcp 62
13:43:44.594125 IP 172.17.0.115.57141 > 54.197.21.112.443: tcp 0
13:43:44.857525 IP 172.17.0.145.5353 > 224.0.0.251.5353: UDP, length 40
13:43:45.165114 IP 172.17.0.159.54915 > 172.17.3.255.54915: UDP, length 263
13:43:45.267709 IP 172.17.0.144.61966 > 255.255.255.255.7533: UDP, length 34
13:43:45.655463 IP 172.17.0.115.57143 > 52.87.242.163.443: tcp 62
13:43:45.676999 IP 172.17.0.148.5353 > 224.0.0.251.5353: UDP, length 40
13:43:45.677002 IP 172.17.0.148.5353 > 224.0.0.251.5353: UDP, length 40
13:43:45.684508 IP 52.87.242.163.443 > 172.17.0.115.57143: tcp 62
13:43:45.684568 IP 172.17.0.115.57143 > 52.87.242.163.443: tcp 0
13:43:45.996530 IP 172.17.0.115.5353 > 224.0.0.251.5353: UDP, length 40
13:43:45.996664 IP6 fe80::87:afde:7488:5d5f.5353 > ff02::fb.5353: UDP, length 40
13:43:46.086489 IP 172.17.0.159.54915 > 172.17.3.255.54915: UDP, length 263
13:43:46.393564 IP 172.17.0.144.61966 > 255.255.255.255.7533: UDP, length 34
13:43:46.700417 IP 172.17.0.148.5353 > 224.0.0.251.5353: UDP, length 40
13:43:46.700468 IP 172.17.0.112.5353 > 224.0.0.251.5353: UDP, length 40
13:43:46.804874 IP 64.233.191.189.443 > 172.17.0.115.50294: UDP, length 81
13:43:46.810292 IP 172.17.0.115.50294 > 64.233.191.189.443: UDP, length 292
13:43:46.810355 IP 172.17.0.115.50294 > 64.233.191.189.443: UDP, length 1151
13:43:46.829508 IP 64.233.191.189.443 > 172.17.0.115.50294: UDP, length 36
13:43:46.905738 IP 172.17.0.145.5353 > 224.0.0.251.5353: UDP, length 40
13:43:46.981120 IP 64.233.191.189.443 > 172.17.0.115.50294: UDP, length 62
13:43:46.981123 IP 64.233.191.189.443 > 172.17.0.115.50294: UDP, length 44
13:43:46.981383 IP 172.17.0.115.50294 > 64.233.191.189.443: UDP, length 42
13:43:46.983256 IP 64.233.191.189.443 > 172.17.0.115.50294: UDP, length 29
13:43:47.008763 IP 172.17.0.115.50294 > 64.233.191.189.443: UDP, length 36
13:43:47.110912 IP 172.17.0.159.54915 > 172.17.3.255.54915: UDP, length 263
13:43:47.253233 IP 172.17.0.115.56963 > 192.30.253.125.443: tcp 0
13:43:47.288071 IP 192.30.253.125.443 > 172.17.0.115.56963: tcp 0
13:43:47.315184 IP 172.17.0.144.61966 > 255.255.255.255.7533: UDP, length 34
13:43:47.934590 ARP, Request who-has 172.17.0.124 tell 10.128.128.128, length 46
13:43:47.934592 ARP, Request who-has 172.17.0.133 tell 10.128.128.128, length 46
13:43:47.934594 ARP, Request who-has 172.17.0.130 tell 10.128.128.128, length 46
13:43:47.934595 ARP, Request who-has 172.17.0.103 tell 10.128.128.128, length 46
13:43:47.937554 ARP, Request who-has 172.17.0.115 tell 10.128.128.128, length 46
13:43:47.937564 ARP, Reply 172.17.0.115 is-at 48:d7:05:cd:1c:53, length 28
13:43:48.134957 IP 172.17.0.159.54915 > 172.17.3.255.54915: UDP, length 263
13:43:48.339045 IP 172.17.0.144.61966 > 255.255.255.255.7533: UDP, length 34
13:43:48.442761 IP 172.17.0.160.5353 > 224.0.0.251.5353: UDP, length 40
13:43:48.442764 IP 172.17.0.160.5353 > 224.0.0.251.5353: UDP, length 40
13:43:48.647249 IP 172.17.0.130.5353 > 224.0.0.251.5353: UDP, length 61
13:43:48.647251 IP 172.17.0.148.5353 > 224.0.0.251.5353: UDP, length 40
13:43:49.158496 IP 172.17.0.159.54915 > 172.17.3.255.54915: UDP, length 263
13:43:49.260341 IP 172.17.0.144.61966 > 255.255.255.255.7533: UDP, length 34
13:43:49.465311 IP 172.17.0.160.5353 > 224.0.0.251.5353: UDP, length 40
13:43:49.568699 IP 172.17.0.146.64321 > 224.0.0.253.3544: UDP, length 40
13:43:49.669981 ARP, Request who-has 172.17.0.156 tell 172.17.0.1, length 46
13:43:49.669988 IP 172.17.0.130.5353 > 224.0.0.251.5353: UDP, length 61
13:43:50.285744 IP 172.17.0.159.54915 > 172.17.3.255.54915: UDP, length 263
13:43:50.286266 IP 172.17.0.144.61966 > 255.255.255.255.7533: UDP, length 34
13:43:51.206136 IP 172.17.0.144.27005 > 255.255.255.255.27015: UDP, length 33
13:43:51.206842 IP 172.17.0.159.54915 > 172.17.3.255.54915: UDP, length 263
13:43:51.309070 IP 172.17.0.144.61966 > 255.255.255.255.7533: UDP, length 34
13:43:51.412316 IP 172.17.0.144.27005 > 255.255.255.255.27015: UDP, length 33
13:43:51.516313 IP 172.17.0.160.5353 > 224.0.0.251.5353: UDP, length 40
13:43:51.616170 IP 172.17.0.144.27005 > 255.255.255.255.27015: UDP, length 33
13:43:52.128992 IP 64.233.191.189.443 > 172.17.0.115.50294: UDP, length 494
13:43:52.154543 IP 172.17.0.115.50294 > 64.233.191.189.443: UDP, length 36
13:43:52.230794 IP 172.17.0.159.54915 > 172.17.3.255.54915: UDP, length 263
13:43:52.230797 IP 172.17.0.116.17500 > 255.255.255.255.17500: UDP, length 157
13:43:52.231432 IP 172.17.0.116.17500 > 172.17.3.255.17500: UDP, length 157
13:43:52.332551 IP 172.17.0.144.61966 > 255.255.255.255.7533: UDP, length 34
13:43:52.486421 IP 172.17.0.115.49306 > 64.233.181.189.443: UDP, length 23
13:43:52.531161 IP 64.233.181.189.443 > 172.17.0.115.49306: UDP, length 33
13:43:52.537201 IP 172.17.0.159.137 > 172.17.3.255.137: UDP, length 50
13:43:52.537727 IP 172.17.0.159.68 > 255.255.255.255.67: UDP, length 300
13:43:52.639628 IP 172.17.0.159.137 > 172.17.3.255.137: UDP, length 50
13:43:52.639697 IP 172.17.0.159.137 > 172.17.3.255.137: UDP, length 50
13:43:52.640015 IP 172.17.0.130.5353 > 224.0.0.251.5353: UDP, length 61
13:43:52.844529 IP 172.17.0.106.137 > 172.17.3.255.137: UDP, length 50
13:43:53.254371 IP 172.17.0.159.54915 > 172.17.3.255.54915: UDP, length 263
13:43:53.254378 IP 172.17.0.159.137 > 172.17.3.255.137: UDP, length 50
13:43:53.356465 IP 172.17.0.144.61966 > 255.255.255.255.7533: UDP, length 34
13:43:53.356471 IP 172.17.0.106.137 > 172.17.3.255.137: UDP, length 50
13:43:53.357006 IP 172.17.0.106.138 > 172.17.3.255.138: UDP, length 222
13:43:53.357009 IP 172.17.0.159.137 > 172.17.3.255.137: UDP, length 50
13:43:53.458854 IP 172.17.0.159.137 > 172.17.3.255.137: UDP, length 50
13:43:53.893062 IP 172.17.0.115.56699 > 172.217.1.46.443: UDP, length 219
13:43:53.893105 IP 172.17.0.115.56699 > 172.217.1.46.443: UDP, length 1350
13:43:53.893120 IP 172.17.0.115.56699 > 172.217.1.46.443: UDP, length 1350
13:43:53.893132 IP 172.17.0.115.56699 > 172.217.1.46.443: UDP, length 511
13:43:53.903164 IP 172.217.1.46.443 > 172.17.0.115.56699: UDP, length 36
13:43:53.928430 IP 172.217.1.46.443 > 172.17.0.115.56699: UDP, length 27
13:43:53.950995 IP 172.217.1.46.443 > 172.17.0.115.56699: UDP, length 61
13:43:53.970702 IP 172.17.0.159.137 > 172.17.3.255.137: UDP, length 50
13:43:53.977470 IP 172.17.0.115.56699 > 172.217.1.46.443: UDP, length 41
13:43:54.175987 IP 172.17.0.159.137 > 172.17.3.255.137: UDP, length 50
13:43:54.175990 IP 172.17.0.159.137 > 172.17.3.255.137: UDP, length 50
13:43:54.278444 IP 172.17.0.159.54915 > 172.17.3.255.54915: UDP, length 263
13:43:54.278447 IP 172.17.0.144.61966 > 255.255.255.255.7533: UDP, length 34
13:43:54.565413 IP 172.17.0.115.57141 > 54.197.21.112.443: tcp 62
13:43:54.579818 IP 172.17.0.115.57192 > 104.79.145.182.80: tcp 0
13:43:54.588685 IP 104.79.145.182.80 > 172.17.0.115.57192: tcp 0
13:43:54.588771 IP 172.17.0.115.57192 > 104.79.145.182.80: tcp 0
13:43:54.595247 IP 54.197.21.112.443 > 172.17.0.115.57141: tcp 62
13:43:54.595310 IP 172.17.0.115.57141 > 54.197.21.112.443: tcp 0
13:43:55.303699 IP 172.17.0.159.54915 > 172.17.3.255.54915: UDP, length 263
13:43:55.303702 IP 172.17.0.144.61966 > 255.255.255.255.7533: UDP, length 34
13:43:55.655787 IP 172.17.0.115.57143 > 52.87.242.163.443: tcp 62
13:43:55.687117 IP 52.87.242.163.443 > 172.17.0.115.57143: tcp 62
13:43:55.687170 IP 172.17.0.115.57143 > 52.87.242.163.443: tcp 0
13:43:55.889132 ARP, Request who-has 172.17.0.115 tell 10.128.128.128, length 46
13:43:55.889149 ARP, Reply 172.17.0.115 is-at 48:d7:05:cd:1c:53, length 28
13:43:55.919978 ARP, Request who-has 172.17.0.119 tell 10.128.128.128, length 46
13:43:55.919981 ARP, Request who-has 172.17.0.151 tell 10.128.128.128, length 46
13:43:55.919982 ARP, Request who-has 172.17.0.138 tell 10.128.128.128, length 46
13:43:55.922651 ARP, Request who-has 172.17.0.147 tell 10.128.128.128, length 46
13:43:56.049753 IP 209.85.234.189.443 > 172.17.0.115.49343: UDP, length 269
13:43:56.076151 IP 172.17.0.115.49343 > 209.85.234.189.443: UDP, length 35
13:43:56.218985 IP 209.85.234.189.443 > 172.17.0.115.49343: UDP, length 86
13:43:56.244853 IP 172.17.0.115.49343 > 209.85.234.189.443: UDP, length 35
13:43:56.326550 IP 172.17.0.159.54915 > 172.17.3.255.54915: UDP, length 263
13:43:56.326553 IP 172.17.0.144.61966 > 255.255.255.255.7533: UDP, length 34
13:43:56.343068 IP 209.85.234.189.443 > 172.17.0.115.49343: UDP, length 269
13:43:56.369069 IP 172.17.0.115.49343 > 209.85.234.189.443: UDP, length 35
13:43:56.894850 IP 172.17.0.115.56699 > 172.217.1.46.443: UDP, length 219
13:43:56.894908 IP 172.17.0.115.56699 > 172.217.1.46.443: UDP, length 1350
13:43:56.894928 IP 172.17.0.115.56699 > 172.217.1.46.443: UDP, length 1350
13:43:56.894944 IP 172.17.0.115.56699 > 172.217.1.46.443: UDP, length 1350
13:43:56.894960 IP 172.17.0.115.56699 > 172.217.1.46.443: UDP, length 734
13:43:56.908846 IP 172.217.1.46.443 > 172.17.0.115.56699: UDP, length 36
13:43:56.910353 IP 172.217.1.46.443 > 172.17.0.115.56699: UDP, length 30
13:43:56.944841 IP 172.217.1.46.443 > 172.17.0.115.56699: UDP, length 61
13:43:56.970857 IP 172.17.0.115.56699 > 172.217.1.46.443: UDP, length 41
13:43:57.247664 IP 172.17.0.159.54915 > 172.17.3.255.54915: UDP, length 263
13:43:57.349943 IP 172.17.0.144.61966 > 255.255.255.255.7533: UDP, length 34
13:43:58.272852 IP 172.17.0.159.54915 > 172.17.3.255.54915: UDP, length 263
13:43:58.272856 IP 172.17.0.144.61966 > 255.255.255.255.7533: UDP, length 34
13:43:58.273118 IP 172.17.0.104.51256 > 224.0.0.252.5355: UDP, length 90
13:43:58.681821 IP 172.17.0.104.51256 > 224.0.0.252.5355: UDP, length 90
13:43:59.090822 IP 172.17.0.104.64469 > 224.0.0.252.5355: UDP, length 90
13:43:59.295921 IP 172.17.0.159.54915 > 172.17.3.255.54915: UDP, length 263
13:43:59.295925 IP 172.17.0.144.61966 > 255.255.255.255.7533: UDP, length 34
13:43:59.398529 ARP, Request who-has 172.17.0.1 tell 172.17.0.145, length 46
13:43:59.500489 IP 172.17.0.104.64469 > 224.0.0.252.5355: UDP, length 90
13:43:59.807677 IP 172.17.0.112.17500 > 255.255.255.255.17500: UDP, length 133
13:43:59.807930 IP 172.17.0.112.17500 > 172.17.3.255.17500: UDP, length 133
13:44:00.185590 IP 172.17.0.115.57175 > 108.174.10.10.443: tcp 0
13:44:00.195026 IP 108.174.10.10.443 > 172.17.0.115.57175: tcp 0
13:44:00.319550 IP 172.17.0.144.61966 > 255.255.255.255.7533: UDP, length 34
13:44:00.319896 IP 172.17.0.159.54915 > 172.17.3.255.54915: UDP, length 263
13:44:00.635765 IP 64.233.181.189.443 > 172.17.0.115.49306: UDP, length 39
13:44:00.661538 IP 172.17.0.115.49306 > 64.233.181.189.443: UDP, length 38
13:44:00.686372 ARP, Request who-has 172.17.0.115 tell 172.17.0.1, length 46
13:44:00.686387 ARP, Reply 172.17.0.115 is-at 48:d7:05:cd:1c:53, length 28
13:44:01.036887 IP 172.17.0.157.5353 > 224.0.0.251.5353: UDP, length 40
13:44:01.036890 IP 172.17.0.157.5353 > 224.0.0.251.5353: UDP, length 40
13:44:01.344524 IP 172.17.0.159.54915 > 172.17.3.255.54915: UDP, length 263
13:44:01.445923 IP 172.17.0.144.61966 > 255.255.255.255.7533: UDP, length 34
13:44:01.753328 IP 172.17.0.130.5353 > 224.0.0.251.5353: UDP, length 61
13:44:01.855566 IP 172.17.0.144.27005 > 255.255.255.255.27015: UDP, length 33
13:44:01.959522 IP 64.233.181.189.443 > 172.17.0.115.49306: UDP, length 39
13:44:01.985614 IP 172.17.0.115.49306 > 64.233.181.189.443: UDP, length 35
13:44:02.060818 IP 172.17.0.144.27005 > 255.255.255.255.27015: UDP, length 33
13:44:02.060826 IP 172.17.0.157.5353 > 224.0.0.251.5353: UDP, length 40
13:44:02.265719 IP 172.17.0.144.27005 > 255.255.255.255.27015: UDP, length 33
13:44:02.267050 IP 192.30.253.125.443 > 172.17.0.115.56963: tcp 31
13:44:02.267103 IP 172.17.0.115.56963 > 192.30.253.125.443: tcp 0
13:44:02.267227 IP 172.17.0.115.56963 > 192.30.253.125.443: tcp 35
13:44:02.302286 IP 192.30.253.125.443 > 172.17.0.115.56963: tcp 0
13:44:02.367615 IP 172.17.0.144.61966 > 255.255.255.255.7533: UDP, length 34
13:44:02.367792 IP 172.17.0.159.54915 > 172.17.3.255.54915: UDP, length 263
13:44:03.289096 IP 172.17.0.144.61966 > 255.255.255.255.7533: UDP, length 34
13:44:03.391673 IP 172.17.0.159.54915 > 172.17.3.255.54915: UDP, length 263
13:44:03.904147 ARP, Request who-has 172.17.0.116 tell 10.128.128.128, length 46
13:44:03.904149 ARP, Request who-has 172.17.0.105 tell 10.128.128.128, length 46
13:44:03.913149 ARP, Request who-has 172.17.0.115 tell 10.128.128.128, length 46
13:44:03.913165 ARP, Reply 172.17.0.115 is-at 48:d7:05:cd:1c:53, length 28
13:44:04.007015 IP 172.17.0.157.5353 > 224.0.0.251.5353: UDP, length 40
13:44:04.313867 IP 172.17.0.144.61966 > 255.255.255.255.7533: UDP, length 34
13:44:04.416053 IP 172.17.0.159.54915 > 172.17.3.255.54915: UDP, length 263
13:44:04.565993 IP 172.17.0.115.57141 > 54.197.21.112.443: tcp 62
13:44:04.595450 IP 54.197.21.112.443 > 172.17.0.115.57141: tcp 62
13:44:04.595502 IP 172.17.0.115.57141 > 54.197.21.112.443: tcp 0
13:44:05.337515 IP 172.17.0.144.61966 > 255.255.255.255.7533: UDP, length 34
13:44:05.440788 IP 172.17.0.159.54915 > 172.17.3.255.54915: UDP, length 263
13:44:05.654827 IP 172.17.0.115.57143 > 52.87.242.163.443: tcp 62
13:44:05.684315 IP 52.87.242.163.443 > 172.17.0.115.57143: tcp 62
13:44:05.684370 IP 172.17.0.115.57143 > 52.87.242.163.443: tcp 0
13:44:05.747483 IP 172.17.0.104.5353 > 224.0.0.251.5353: UDP, length 40
13:44:05.747486 IP 172.17.0.104.5353 > 224.0.0.251.5353: UDP, length 40
13:44:06.361164 IP 172.17.0.144.61966 > 255.255.255.255.7533: UDP, length 34
13:44:06.463744 IP 172.17.0.159.54915 > 172.17.3.255.54915: UDP, length 263
13:44:06.771902 IP 172.17.0.104.5353 > 224.0.0.251.5353: UDP, length 40
13:44:07.130050 IP 172.17.0.115.50294 > 64.233.191.189.443: UDP, length 23
13:44:07.174858 IP 64.233.191.189.443 > 172.17.0.115.50294: UDP, length 33
13:44:07.284588 IP 172.17.0.144.61966 > 255.255.255.255.7533: UDP, length 34
13:44:07.385633 IP 172.17.0.159.54915 > 172.17.3.255.54915: UDP, length 263
13:44:07.997110 IP 172.17.0.115.57187 > 52.84.67.50.443: tcp 0
13:44:08.007748 IP 52.84.67.50.443 > 172.17.0.115.57187: tcp 0
13:44:08.306976 IP 172.17.0.144.61966 > 255.255.255.255.7533: UDP, length 34
13:44:08.409576 IP 172.17.0.159.54915 > 172.17.3.255.54915: UDP, length 263
13:44:08.818870 IP 172.17.0.104.5353 > 224.0.0.251.5353: UDP, length 40
13:44:09.331626 IP 172.17.0.144.61966 > 255.255.255.255.7533: UDP, length 34
13:44:09.433255 IP 172.17.0.159.54915 > 172.17.3.255.54915: UDP, length 263
13:44:09.444287 IP 172.17.0.115.57154 > 52.84.1.51.443: tcp 0
13:44:09.453790 IP 52.84.1.51.443 > 172.17.0.115.57154: tcp 0
13:44:10.355139 IP 172.17.0.144.61966 > 255.255.255.255.7533: UDP, length 34
13:44:10.457211 IP 172.17.0.159.54915 > 172.17.3.255.54915: UDP, length 263
13:44:10.492449 IP 172.17.0.115.57195 > 172.217.1.46.443: tcp 0
13:44:10.501743 IP 172.217.1.46.443 > 172.17.0.115.57195: tcp 0
13:44:10.570573 IP 172.17.0.115.57152 > 52.84.67.136.443: tcp 184
13:44:10.570615 IP 172.17.0.115.57152 > 52.84.67.136.443: tcp 46
13:44:10.579362 IP 52.84.67.136.443 > 172.17.0.115.57152: tcp 0
13:44:10.579620 IP 52.84.67.136.443 > 172.17.0.115.57152: tcp 0
13:44:10.585746 IP 52.84.67.136.443 > 172.17.0.115.57152: tcp 46
13:44:10.585785 IP 172.17.0.115.57152 > 52.84.67.136.443: tcp 0
13:44:10.657716 IP 172.17.0.115.57175 > 108.174.10.10.443: tcp 194
13:44:10.657764 IP 172.17.0.115.57175 > 108.174.10.10.443: tcp 46
13:44:10.657789 IP 172.17.0.115.57175 > 108.174.10.10.443: tcp 156
13:44:10.659007 IP 52.84.67.136.443 > 172.17.0.115.57152: tcp 376
13:44:10.659011 IP 52.84.67.136.443 > 172.17.0.115.57152: tcp 38
13:44:10.659059 IP 172.17.0.115.57152 > 52.84.67.136.443: tcp 0
13:44:10.659079 IP 172.17.0.115.57152 > 52.84.67.136.443: tcp 0
13:44:10.668169 IP 108.174.10.10.443 > 172.17.0.115.57175: tcp 0
13:44:10.668174 IP 108.174.10.10.443 > 172.17.0.115.57175: tcp 46
13:44:10.668258 IP 172.17.0.115.57175 > 108.174.10.10.443: tcp 0
13:44:10.826537 IP 108.174.10.10.443 > 172.17.0.115.57175: tcp 108
13:44:10.826541 IP 108.174.10.10.443 > 172.17.0.115.57175: tcp 402
13:44:10.826582 IP 172.17.0.115.57175 > 108.174.10.10.443: tcp 0
13:44:10.826599 IP 172.17.0.115.57175 > 108.174.10.10.443: tcp 0
13:44:11.050500 IP 172.17.0.115.49343 > 209.85.234.189.443: UDP, length 23
13:44:11.095842 IP 209.85.234.189.443 > 172.17.0.115.49343: UDP, length 30
13:44:11.276337 IP 172.17.0.144.61966 > 255.255.255.255.7533: UDP, length 34
13:44:11.481516 IP 172.17.0.159.54915 > 172.17.3.255.54915: UDP, length 263
13:44:11.677041 IP 172.17.0.115.57141 > 54.197.21.112.443: tcp 54
13:44:11.683315 IP 172.17.0.115.57143 > 52.87.242.163.443: tcp 54
13:44:11.746438 IP 54.197.21.112.443 > 172.17.0.115.57141: tcp 0
13:44:11.748740 IP 52.87.242.163.443 > 172.17.0.115.57143: tcp 0
13:44:11.888360 ARP, Request who-has 172.17.0.115 tell 10.128.128.128, length 46
13:44:11.888376 ARP, Reply 172.17.0.115 is-at 48:d7:05:cd:1c:53, length 28
13:44:11.992915 ARP, Request who-has 172.17.0.112 tell 10.128.128.128, length 46
13:44:11.992957 ARP, Request who-has 172.17.0.120 tell 10.128.128.128, length 46
13:44:11.993103 ARP, Request who-has 172.17.0.122 tell 10.128.128.128, length 46
13:44:11.993344 ARP, Request who-has 172.17.0.149 tell 10.128.128.128, length 46
13:44:11.993465 ARP, Request who-has 172.17.0.158 tell 10.128.128.128, length 46
13:44:12.095378 IP 172.17.0.155.137 > 172.17.3.255.137: UDP, length 50
13:44:12.096239 IP 172.17.0.155.53243 > 224.0.0.252.5355: UDP, length 22
13:44:12.300590 IP 172.17.0.144.61966 > 255.255.255.255.7533: UDP, length 34

